,0
321,"Daily Discussion, August 11, 2022"
322,"Does anyone here have experience with the Auto Invest feature Binance offers? If so, would you recommend it?"
323,"IMF Head Foresees the End of Banking and the Triumph of Cryptocurrency. Bitcoin ""puts a question mark on the fractional banking model we know today."""
324,"Daily Discussion, August 10, 2022"
325,Can someone help me resolve this issue in Fulcrum (Electrum Server)?
326,New U.S Bill Allows Crypto and Blockchain Advisor to White House
327,"This one’s a tricky one. If he already purchased bitcoin and moved it off the exchange, what will the authorities be able to do? This is from my hometown in Pennsylvania."
328,One of the three stock 3d files on Ender 3 is a printed Bitcoin.
329,Bitcoin (Cassascius coin 2011) in the British Museum.
330,"Once used to bitcoin, other things make less sense"
331,"Michael Saylor on storing money in currency vs. Bitcoin: ""Bitcoin is an option for anybody in the world that lives in a nation where they can't trust the bank or they can't trust the local currency—and that's the killer app for them."""
332,Kraken released an analysis of PoW vs. PoS - Results are fascinating and proves why Bitcoin PoW is king.
333,How to turn any Swiss post office into a crypto ATM
334,"Daily Discussion, August 01, 2022"
335,Corruption of fiat
336,How to gauge lender safety
337,Swan Bitcoin’s email data was leaked by a third-party
338,"I want to buy a nano. Which one would you suggest? I want it to be future proof, if that may be a concern."
339,Lost Bitcoin hard drive guy
340,Top 5 situations to sell btc
341,"a couple Forbes articles from mid 2020, thoughts?"
342,The Guy who claims to have lost $184m of Bitcoin in a dump is now promising a 10% finders fee if the authorities help him recover it.
343,"I have all my crypto on Binance, what's the best place to put them in to be safe?"
344,8:30 AM Eastern Time US CPI announcement
345,"There is no chance that Bitcoin's supply cap will be removed. In order for that to happen, you'd have to convince millions of Bitcoin users to devalue their holdings for someone else's, rather than their own, benefit."
346,Coinbase paying 203k sats to migrate from Pro to Standard
347,"If you have a hot wallet, does this mean your keys are stored on a server not under your control that is exposed to the internet?"
348,Senate Bill Classifying Bitcoin As A Digital Commodity To Be Introduced Today: Report
349,"Bitcoin Gains on Optimistic CPI Print, But Will a Rally Follow?"
350,Microstrategy's official announcement on separation of CEO and Chairman roles.
351,The Value Exchange: Valuing Bitcoin by Fidelity Investments
352,"From a market perspective, and a tax perspective, buying things with Bitcoin is EXACTLY THE SAME as selling your Bitcoin."
353,"TIL Blackrock is the second largest holder of Microstrategy stock after Saylor, at 7.3%"
354,Mycelium
355,Some questions regarding online payment using Bitcoin
356,Researchers discover vulnerabilities in Bitcoin layer-2 Lightning Network
357,what do banks do with the money that i deposit?
358,"Bitcoin has already bottomed, has a fair value of $40,000, says Anthony Scaramucci"
359,The Federal Reserve and Inflation. Up 8.5% in July from a year ago. Core CPI rose 5.9% annually and 0.3% monthly. Including a 1.1% monthly increase in food prices.
360,Don't knock it till you try it!
361,Buying tickets for my movie date and found out I can pay with Bitcoin!
362,Open source BoltCard - no need to buy one from nor use with CoinCorner app
363,PolloFeed is the ecnomic indicator of Bitcoin. The chicken feeder is empty therefore the Bitcoin economy is booming and people have extra money to feed chickens.
364,Bitcoin in Menorca!!!!! First of 6 shops in Mahon (capital of Menorca) that I saw that accept Bitcoin! Proud of us Spainards
365,I think I might just put all my money in Bitcoin for the rest of my life because no one can take it.
366,Block #747648 has just been mined with only the coinbase transaction. WTF!?
367,🚨 Warning?
368,Satoshi Nakamoto holding a honey badger.
369,Get your cheese out of the shops
370,Will bitcoin mining fix climate change? Troy Cross thinks so.
371,What are the arguments against ASIC resistance?
372,HELP!
373,I made some Bitcoin art
374,Kenyan Bitcoiners
375,Bitcoin Lightning Network could disrupt $150B year payment/remittance industries
376,Fred Foldvary was a bitcoiner before all y'all
377,Bitcoin vending
378,Can I get a Meow Bitcoin
379,I'm curious if anyone on here runs some BTC ATM style kiosks. Do people actually use them? are the profitable? I just walk by and think the fees on those must be crazy high.
380,Post-quantum encryption contender is taken out by single-core PC and 1 hour
381,Launch Cart Partners with OpenNode to Allow BTC Payments For Firms
382,From Death to Alive .... HODL
383,"looking for any place(food) in Kyiv, Ukraine where I can pay with bitcoin (lighning network)"
384,UK BTC/Crypto OTC platforms?
385,It took like 10 centuries for banknotes to outperform bartering. When Bitcoin is gonna become a major currency?
386,"⚡ Lightning Thursday! August 04, 2022: Explore the Lightning Network!⚡"
387,Help: BRD Wallet Migration Issue
388,Inversely backed Bitcoin? Can someone explain how rhis is a good thing?
389,"I believe that Satoshi's disappearance was the best thing for Bitcoin, because creators distract from a network's progress without providing much benefit."
390,Nocoiners in 2069:
391,"Made this ₿Itcoin ₿lackhole digital artwork for everyone here. An artistic example of ₿Itcoin’s finite properties that have the ability to absorb the value of everything in the world that is traded for it, while maintaining its finite, yet ever financial value growing ₿lackhole"
392,Michael Saylor Provides a List of Arguments to Use When Attempting to Convince Others of Bitcoin's Energy Efficiency (short audio clip)
393,Bitcoin Treasure Hunt
394,Bitcoin maximalism is the idea that you need to fix the money first
395,Behold the bitcoin tooth fairy
396,BlackRock Offers Institutions Direct Exposure to Spot BTC
397,"Bitcoin doesn’t have to be scary and custodying your Bitcoin doesn’t have to be hard. I believe that custodying your Bitcoin yourself can be the best way to keep them safe, if you do it right."
398,"Wall Street's king, Jamie Dimon, on Bitcoin through the years. Can we say he has a case of FOMO? 2017/2021/Now"
399,Cold Storage Coins
400,"Down With Fiat, Bitcoin Blesses Developing Countries"
401,Shakepaid twice in a row! stacking sats every way I can
402,Economic Effects of Using Bitcoin as a Payment Alternative in the United States.
403,Blockchain transaction ID not showing
404,Peerswap: A Decentralized Lightning Network Node Rebalancing Tool | BitDevsLA
405,Coinbase Has Rallied 90% this week. It Could Be Another GameStop Moment.
406,Some of the best DALLE-2 images i made with the bitcoin logo in the last few days :)
407,Channel 4 Bitcoin Documentary on Tonight at 10pm
408,What ‘crypto winter?' Schwab launches ETF giving investors significant cryptocurrency exposure
409,Stablesats: bringing stable payments to Lightning Network
410,Michael Saylor on turning $250 million to $6 billion with Bitcoin
411,Chinese Crisis Drastically Impacting Bitcoin.
412,Mega Bitcoin Mining Firm Bitfarms Increased Power to Over 160 MW in July
413,"Never forget the bitcoin network has the potential to help billions of humans and in some cases, saves lives. This technology is more profound and far-reaching than many realize today."
414,Can a socialist.system of taxation and redistribution of wealth be created using blockchain and replace governmental economic policy?
415,Bitcoin accepted here in a cocktail bar South Australia
416,Why was Bitcoin created | Gateway to Crypto
417,"Iran Places First Crypto-Funded Import Order, Worth $10M: Report"
418,Bitcoin Oracles? Tell Me More...
419,Bitcoin Community Contribution Score
420,Did our Government study Economics?
421,End of the Road: How FIAT Money Became Worthless👨‍🏫
422,Bitcoin and UFOs
423,"Is it possible, I can create a wallet that requires two keys unlock and spend funds?"
424,Bitcoin is a horrible replacement for money.
425,"Obviously, the best time for everyone to integrate with lightning is ASAP, but what is a reasonable timeline to expect it to hit mass adoption?"
426,Bitcoin vs Modern Money Systems
427,Few understand... how to read
428,Synthetic Bitcoin Backed Dollar Start up Project Gets $4 Million in Funding
429,Shitty cast after shitty cast….must be winter? I need a new pattern…..
430,Bitcoin flashing software - Script
431,"How Time Flies! Two Years Ago, Michael J. Saylor Decided to Go All-in on Bitcoin With MicroStrategy A decision that will make him the best CEO (or Chairman now) of the decade by 2030."
432,The future of mining!
433,Ledger doubled my deposit?
434,Wisdom from Buckminster Fuller
435,Bitcoin data analytics sites - which are your favorites?
436,How do I open a old wallet.dat file with Bitcoin Core on a new machine
437,Adoption? 👀
438,Bitcoin makes renewable energy viable
439,$6.3 trillion in newly printed dollar. M2 money supply and CPI.
440,bitcoin bar
441,Sovereign wealth isn't going to come cheap
442,Iran made import operation for $10 million in Bitcoin and wants to continue
443,"Nigerians, how are you feeling with the current situation of our currency"
444,It's still not too late
445,Swan Bitcoin vs Binance.US
446,"What would you actually do, if tmr you find out your father/mother is Satoshi N, and owns 1m Bitcoin?"
447,Bullish
448,I made a Tapsigner tutorial (NFC Bitcoin card) alongside Nunchuk mobile wallet. TLDW; pretty good/cheap option for on-the-go cold storage.
449,The Rift in Bitcoin Community is Based On Misunderstanding The Criticism.
450,Bitcoin Optech Newsletter #212
451,PornHub and Bitcoin
452,DCA + Taxes = Nightmare?
453,"How can I store my ledgers so that they are resistant to fire, earthquake, EMP, and possible incoming attacks?"
454,Which app you recommend and why ?
455,"Buy mix and store Bitcoin without KYC - I made a full tutorial using Robosats, Sparrow Whirlpool and Coldcard. Hope this is helpful."
456,"Does Bitcoin have a secret root certificate private key? If so, what is it used for?"
457,My credit union let's you purchase Bitcoin.
458,Indian Authorities Imposed a Frozen Order on Vauld Exchange Assets
459,I'm really confused between miner fees and miner rewards.
460,Why is Saylor a Bitcoin Evangelist?
461,More AI generated Bitcoin art (cold storage)
462,How to setup bitcoin-core snap on Ubuntu 22.04?
463,Mining Month incoming with @JonPDiGiacomo
464,What is Bitcoin?
465,Wouldn't bitcoin eventually just make the rich richer?
466,"The ups and downs of July passed perfectly, sharing some news about BTC."
467,The Companies Banking the Most on Bitcoin
468,USD as paper-ish wallet / QR
469,Capture the Bitcoin (Scavenger/Challenge) - Review
470,How Crypto Replayed the 2008 Financial Crisis with David Morris — What Bitcoin Did
471,Hodlnaut halting withdrawals
472,Tuesday Tutorial | Airgapped Bitcoin Transactions With The COLDCARD Wallet Made By Coinkite | Featuring BTC Sessions
473,Casa Self Custody UX - Positive or Negative?
474,What Are Stablesats? Creating Synthetic Dollars on the Bitcoin Lightning Network
475,What is this worth?
476,why I believe BTC will NEVER go to zero
477,River Financial coming strong with the zero-fee DCA...
478,Coffee delivered for bitcoin—it is a good day
479,Casa leaked Personal Information of customers
480,Whats the best Bitcoin/Crypto podcast?
481,Give me one good reason why I should not use legacy (1xxx) uncompressed addresses.
482,Top Bitcoin Holding companies
483,Bitcoin maximalism
484,Incredible aerial views of TeraWulf's Lake Mariner facility on the shores of Lake Ontario! It will reach 500 MW of demand and 91% of market energy comes from zero carbon resources.
485,"Discussion: In your OWN words, how do you define BTC?"
486,"In July, Hut 8 continued its BTC “HODL approach” despite miner capitulation."
487,The Mathematics of Bitcoin ''EMS Newsletter March 2020 ''
488,BlackRock Teams Up With Coinbase in Crypto Market Expansion
489,Does coinbase btc sell on upi get taxxed
490,"The energy used for POW is not a waste. BTC is on the ""energy standard"" just like money were on the ""gold standard"" - an idea proposed also by Henry Ford - link inside"
491,[Before/After] The same plot of empty land in September 2021 compared to today where this Bitcoin Mining Plant by Lake Mariner has been built!
492,just a question
493,Satoshi Nakamoto riding the wall street bull by DALL-E 2
494,Bitcoin x Starlink (spaceX) to decentralise Education (uplift Education 1 Million X)
495,Just received my Tapsigner. Excited!
496,"Stadicus from Shift Crypto: BitBox02, open source, Bitcoin-only firmware, security theater, Bitcoin nodes, RaspiBolt & a pragmatic approach to hardware wallets"
497,"Can you really use Bitcoin in Tofo, Mozambique?: Paco de la India travels to Tofo and meets with Bitcoiners using BTC for remittances and their small businesses."
498,32 BTC were traded last week in Venezuela measured only using LocalBitcoin. Monthly minimum wage is now less than 23 USD.
499,"BTC Hardware Wallets... don't they all violate ""Don't Trust""?"
500,Honest question What real life problem(s) does bitcoin solve? I’m trying to figure out a use case to justify owning and can’t come up with a good reason. It seems nothing but hype; certain people using social media power to keep the bitcoin story alive. It has no inherent value or no real use IMO
501,Blockchain.c0m Under Review
502,AI generated art of a Pug with Bitcoin
503,El Salvador and Bitcoin
504,Should Drivechains Come to Bitcoin? With Paul Sztorc — What Bitcoin Did
505,BITCOIN Clips This Week | Blackrock & Coinbase | SEC vs CFTC | Securities | Cory Klippsten | Saylor | Natalie Burnell | Brian Armstrong | More
506,"Craig Wright v Peter McCormack: Judge ruled that Craig Wright, who claims to be Bitcoin inventor Satoshi Nakamoto, advanced false evidence."
507,Natural gas producers are willing to invest in Bitcoin mining technology if they can get a reasonable payout and solve the environmental issue of their emissions profile
508,Another court case fails to unlock the mystery of Bitcoin’s Satoshi Nakamoto
509,"UK inflation will soar to ‘astronomical’ levels over next year, thinktank warns"
510,An interesting thought for all of us.
511,Small Reoccurring BTC Investments?
512,"Possible scam, but cant figure out how?"
513,I use the Bitcoin wallet app - does my public address remain the same throughout?
514,Latest Bloomberg Intelligence report predicts that bitcoin will continue being the “best performing asset” this decade
515,Beware Strike Account Review
516,Looking to run a Bitcoin node
517,Bitcoin wallet
518,WHere to buy
519,41MW of Bitcoin mining equipment is turned on by Iris Energy earlier than expected.
520,Any resources that you've come across that discuss future services for Bitcoin?
521,The largest block ever mined has just been added to the bitcoin blockchain. 2.77MB!
522,is this normal with sparrow wallet?
523,Identifying Exchange with Blockchain Address
524,How To Safely Store Bitcoin Without A Hardware Wallet?
525,Interesting discussion
526,Question about hardware wallet testing
527,Is it overly risky to build up a fiat reserve (dry powder) on Strike?
528,Mining bitcoin with biogas from farm waste
529,Business is business. Gotta adapt to customer needs to make money.
530,Bitcoin Independence Day: Luke Dashjr On The Lessons From Segwit That We're Forgetting
531,The market has been pretty flat for the past two weeks. Is it because everyone went to the party in Miami?
532,A journey to Bitcoin Citadel
533,91% of the 21 million Bitcoin supply has been mined today. The remaining 9% will be mined over the next 118 years.
534,Guessable private keys and this address: 1H1miBUpEgLiUJ9ooxu6bgP6N2BzHshWpW
535,"⚡ Lightning Thursday! August 11, 2022: Explore the Lightning Network!⚡"
536,Bitcoin's safety and Quantum Computing
537,I wonder how BTC 1 looks like...
538,The story of how my father lost all his Bticoin
539,The Fight for Free Speech is the Fight for Bitcoin
540,I don't see the viability of Bitcoin as a 'currency'.
541,Every Conversation...
542,BTC.net
543,"New Bitcoin neobank start-up, NOAH, just allowed all waitlist users in the web-app to claim their lightning address."
544,US bans tornado cash. Will bitcoin wallets Wasabi and samurai be next!?
545,"Are there any movies where BTC is thre accepted global currency, reserve, or settlement later?"
546,We are all Satoshi
547,How many wallets own at least 1 BTC?
548,"Mobile wallets that allow labeling transactions, so we can remember who we sent money to"
549,Question about blackrock partnership
550,"😎 bro, is you ready to mine the last 9%?!"
551,Modular mining with stranded energy
552,"Blackrock- a warm, fuzzy company looking out for your best interest"
553,The miner capitulation is not over yet? Long time no news of a massive sell-off of BTC? Only buy buy buy!
554,Lost coins
555,What happened to all the Mt. Gox noise?
556,"And I thought Charlie Munger said it was tat poison,BlackRock must love poison?"
557,How to colllect all Binance Exchange wallet address
558,Why do I keep getting this when opening my coinbase wallet??
559,Athletes are being paid in Bitcoin more and more frequently
560,Orchard botnet uses Bitcoin Transaction info to generate DGA domains. Experts spotted a new botnet named Orchard using Bitcoin creator Satoshi Nakamoto’s account information to generate malicious domains.
561,Jack Dorsey’s company Block released some details about their upcoming hardware wallet
562,The joy of online banking
563,I’m interested in running a node.
564,How many of you really were able to really Orange Pilled your significant other?
565,"Jorge from Mozambique: ""I'm learning a lot. Bitcoin is making my life easier. It helps to support my family and four children."""
566,"does anyone know any Bitcoin wallets that accept PayPal as a form of deposit, that isn't only available in the US?"
567,When “he asks for his allowance in Bitcoin - not on Coinbase though!”
568,Channel4 documentary on Bitcoin
569,The NY Times Feature On Bitcoin Maximalism Is Full Of Surprises. Here Are A Few
570,Strike Deposit Error
571,"It was strong, it is strong and it will be strong!"
572,Saylor Steps Down and China & Taiwan Heats Up with Sidd @CaptainSiddh - State of Bitcoin Ep. 34
573,Blackrock launches direct BTC exposure for US investors
574,This Honduras town is accepting Bitcoin as a part of an initiative by the municipality
575,"""Bitcoin fixes Earth with light beam"""
576,What actually are the mathmatical equations that mining solves?
577,Cold wallet setup in a usb memory stick
578,why is are reversible transactions possible in the legacy financial system & is this really a problem (qning the Bitcoin whitepaper)
579,Need help with using General Bytes BATMFour BTC ATM
580,The BIG ONE - Prediction for Bitcoin
581,Best Exchange for DCA?
582,found this box of instant noodle at the local Asian market
583,"Saving is dead with fiat money, debt is not available for everyone, Bitcoin is the solution"
584,"If we had been on a Bitcoin standard when the pandemic hit, how would the government have kept everyone on furlough? Was furlough a valid case for money printing?"
585,One thing that the nocoiners never address: The massive US debt of 140% of GDP - How is this current level of fiat debt sustainable?
586,Artwork designed by AI
587,A good sign
588,cegen = degenerate in CeFi
589,"When Nocoiners Say ""Bitcoin Has No Value"""
590,Eurodollar & The Money Printer with Lyn Alden — What Bitcoin Did
591,Statistics on Bitcoin Use for Mundane Purchases
592,bitcoin restaurant in kenya
593,Craig Wright is a liar. Craig Wright is not Satoshi.
594,Top cryptocurrency news: BlackRock announces the launch of a new private spot BTC trust
595,US based DCA - where is the best place?
596,Do you want to support bitcoin adoption across the Netherlands?
597,How do block rewards get distributed exactly?
598,Bitcoin mining: how can we make it greener?
599,"If you had invested $10,000 in Gold 10 years ago, you would have today $10,097. If you had invested $10,000 in Bitcoin 10 years ago, you would have today $23M. Bitcoin is not a simple store of value as gold. Bitcoin is far better. Bitcoin is a booster of value."
600,Stop asking companies to accept Bitcoin as payment. Instead ask them to give you BitcoinBack on your FIAT purchases.
601,Bitcoin Fixes This!
602,Bisq user experiences
603,Which one of you is this?
604,"Landfills in Argentina, India, Pakistan leak upto 29 tons of methane PER HOUR. Bitcoin fixes this!"
605,"SwanBitcoin and 44 other bitcoin and shitcoin company email lists leaked by third-party email provider Klaviyo ; leak data includes first name, email, and in some cases ip-based geolocation - [Swan Email] - CoinCorner wasn't affected"
606,Is it too late to get into cryptocurrency?
607,How do you even reply to replies like this? Post in 2nd screenshot
608,Transfer from legacy to native segwit
609,Remember last year when the media tried to convince everyone that the FBI had hacked a Bitcoin private key? Total FUD.
610,the meeting
611,Honestly if you had just invested in bitcoin you’d probably be better off. No front running needed. No $250k to $0. Less stress.
612,Bitcoin Libre wallet - thoughts
613,"First ever Bitcoin purchase !! 0.00012821 btc it’s about time my miner bought me a pint !!, hopefully this turns out to be the most expensive pint of beer Of beer in history !!"
614,Truly a bearer asset
615,"""Pay with Lightning"" Badge - Free Download"
616,"Archived Video: Blackrock CEO Larry Fink Asked About Bitcoin By Former Reuters CEO at Council on Foreign Relations Call | Mark Carney Was Also in Attendance | Dec 2, 2020"
617,Tomorrow is 08.04 are we ready for Skynet
618,Today marks the end of a years-long duel between US and Russian authorities to try to get Vinnik into custody for $4 billion worth of Bitcoin money laundering from BTC-e. Vinnik has been under indictment in the Northern District of California since 2017.
619,21-year-old got ‘thought-provoking’ questions after teaching crypto to old folks
620,"Lightning Network capacity just made a new ALL-TIME high at 4,469K"
621,Wallet suggestions?
622,The Giving Block
623,"""Companies' attempts to maximize profits,"" A leading cause of inflation..."
624,Samsung’s 3nm trial production run this week to make Bitcoin miner chips - Bitcoin Mining pushing the boundaries of microchip manufacturing
625,Cold storage options other than hardware wallets?
626,Eminent Cheetahs Original Now you can Buy Through Bitcoin 130$
627,Bitcoin Crash Isn’t Affecting the Average Person in El Salvador
628,Do you think Satoshi would be proud of what Bitcoin has become at $23k today?
629,Better late than never!
630,Spot ETF / Bitcoin in a 401k? How does it work with Bitcoin?
631,Bitcoin mining difficulty hits 5-month low as miners close
632,There's a Bitcoin bootcamp that teaches Lightning programming entirely on Replit
633,"Given that Bitcoin cannot be recreated , it’s distribution cannot be replicated , along with it being unhackable / corruptible . The only logical conclusion is that is must be priceless."
634,Bitcoin Vs. Hip Hop: Deeper Than Rap
635,Bitcoin AMA with Pierre Rochard
636,Any Bitcoin-only exchanges in the EU?
637,"“Das Krisenjahr” – The Trauma of the Hyperinflation of 1923 During the Weimar Republic in Germany. A historical reminder of why the money creation power should not be in the hands of the State, and why hard money like Bitcoin is essential for the future."
638,"We've just launched the Asset Issuer platform for the Liquid Network, the new financial layer for Bitcoin."
639,What is Money? Michael Saylor Upskilling Tucker Carlson - Best quotes
640,Why does it seem like “BTC is going to zero” is being discussed more than ever? Is it because we’re in a bear market or are there other reasons behind it?
641,Dubai based retail giant Day To Day will accept Bitcoin
642,The $ is not your friend
643,Popular Shark Tank Investor Kevin O’Leary Has Stated He Has Bought The Bitcoin Dip
644,Is This Australian Scientist The Inventor Of Bitcoin?
645,"Mary Imasuen from Lagos, Nigeria has been buying $1 of bitcoin everyday for the past 200 days. Her advice, ""make bitcoin part of your lifestyle and look outside the box for ways you can solve problems with bitcoin"""
646,Funding Investments Through Borrowing - Done Right
647,A few understand what a real value means and how it changes the technology and the future - HODL - we are still early
648,What if blackrock wants to buy all the bitcoin?Would they risk 1 trillion to make bitcoin go to zero? How much supply would they need to set the price of bitcoin at zero?
649,It's Now Illegal for US Citizens to Use These 2 Crypto 'Mixing' Sites - Allegedly North Korea Uses Them To Launder Hacked Coins...
650,"With more countries moving to the Brics system, how long will it take for the downfall of that system before its eaten by bitcoin?"
651,Tomorrow we will get the verdict in the McCormack (What Bitcoin Did) podcast vs Craig Wright case.
652,It’s that time
653,Reused an address (to myself)
654,"Bitcoin's Decentralization Endures as Centralized Crypto Platforms Implode | Coinbase, Galaxy Digital, Celsius and Now Tornado Cash"
655,Just another node...
656,(Who is this guy?) A new unknown investor bought bitcoins for $3 bill
657,"Would you rather go to prison, or relinquish your Bitcoin?"
658,Bitcoin = money + time + energy + information
659,"Six months of hyperinflation in Zimbabwe, from 2008 to 2009."
660,Scrub your devices peeps!! Found in what I thought was a new MiFi router.
661,Bitcoin Budapest
662,Why China is causing the next global financial crisis
663,What is the best way to store my Bitcoin?
