,0
664,"Starting next week, Israel will prohibit cash transactions above $4,400 and business transactions above $1,760."
665,SLP404 Gloria Zhao – What Do Bitcoin Core Maintainers Do?
666,The S&P500 is completely flat (0% yield) since 1997 when it is normalized against the M2 fiat currency supply. How did buying productive assets work out?
667,Iran makes the first import order using cryptos
668,"“With or without me, with or without you- Bitcoin will be the money of the world. So it’s up to us to make sure that it’s actually freedom money and not cuck money”. -@ODELL"
669,"Mentor Monday, August 01, 2022: Ask all your bitcoin questions!"
670,"Once you in , never Out"
671,Fold App review for DCA into bitcoin
672,Wallet
673,Bitcoin Fixes this - Man holds up bank to withdraw his own money
674,"In Crypto Winter, Jesse Powell’s Pirate-King Leadership Style Might Be the New Normal"
675,Iran used unspecified crypto for trade. Iran is a sizeable bitcoin mining country.
676,Why would you knowingly invest in proof of work?
677,Bitcoin Optech Newsletter #211
678,Bought $100 dollars worth of Bitcoin yesterday and plan to buy more.
679,Gen ₿ - my boy (5 y/o) paying for an ice cream with Bitcoin Lightning!
680,I've got steps 1 and 2 down. What's next?
681,Brian Armstrong on Bitcoin as a Global Reserve Currency
682,I asked AI to show me peasants fighting over the last Bitcoin.
683,"""It's possible to embark on a bloodless revolution against the violent organizations and barbaric leaders who've trashed the economy"". Clip from the documentary Four Horsemen (2012)."
684,The Bitcoin Beach wallet is adding a new feature: Bitcoin-backed U.S. dollars on the Lightning network.
685,"“It’s Potentially Illegal”: As Crypto Crashed, Coinbase Stopped Some Notifications"
686,"Decentralizing Global FX With Taro: How Bitcoin Renders ""Cross-Border"" Payments Obsolete 🍠💱"
687,Bitcoin's Blockchain as Multiverse Directory
688,Which exchange has the lowest fee to DCA Bitcoin?
689,"I usually just use it to buy drugs, those are real things (crypto ad I saw on reddit)"
690,German Bitcoin Bank Nuri ex Bitwala files for bancrupcy.
691,"Bitcoin Mining Now Uses 10.9% More Renewables, Goes Unreported"
692,if anyone wants to come my on podcast just let me know! everyone is welcome from newcomers to maxis 😊 it’s all about education 🍊💊
693,"Peter Van Valkenburgh, of Coin Center, on the OFAC Tornado cash"
694,A day in the life of Wojak
695,"Governments will try to control Bitcoin, and they will fail."
696,Bitcoin art that mines bitcoin
697,How do I get my bitcoin from coinbase into a hardware wallet? Looking for help from those who have successfully done it and are willing to explain.
698,Are there any bitcoin credit cards that are worth it?
699,1oz Silver Proof gold gilded Round. 😍😍😍😨😨 #shorts #shorts #bitcoin #crypto
700,What am I getting wrong?
701,Biden announces 0% inflation. Mission Accomplished!
702,Steve Wozniak explains Bitcoin as Mathematics
703,"In light of the only true Bitcoin's (BitcoinSV) recent achievement of surpassing a Blockchain size of 5,000 Gb, I thought I would help you guys get started on running a full node! (Satire, not factually correct)"
704,24K Digital Gold! (again)
705,I made a website to show you what crypto exchanges are available in your state in the US!
706,"Daily Discussion, August 09, 2022"
707,Mining with an s9k..?
708,Campbx News!
709,Bitcoin And Freedom Or International Communism
710,KYC/Non KYC wallets on the same node?
711,Airport terminal flip board style website to watch the price of Bitcoin
712,"Greg Foss: ""Do your own research. Dont believe the FUD. If you own zero bitcoin you are taking far more risk. What is the proper number of bitcoin to own is for you to determine, but it is not zero. Zero is the wrong answer."""
713,What happened to the old Bitcoin?
714,Border Wallets: Using patterns to store and recall seed phrases
715,Bitcoin Sunday’s (make it a thing)
716,Send BTC transaction via SMS
717,"All Bitcoin, No Fiat with Sahil Chaturvedi — What Bitcoin Did"
718,VIDEO: Happy Bitcoin Independence Day | UASF BIP148 Anniversary | This August 1st Run a Bitcoin Node!
719,Bitcoin Price Could Rally If..
720,"Growing concerns as Blockchain.com's Wallet App, API and Exchange apparently down for +11 hours."
721,"Lawyer Preston Byrne (@prestonjbyrne) Breaks Down the Proposed Third Tier of Property in the UK, Which Would Capture Bitcoin (The Canadian Bitcoiners Podcast)"
722,if everything goes as it has before btc won't reach new heights before 2024/5 right?
723,A look at the lightning network (Lyn Alden)
724,Bitcoin tourism spikes in El Salvador despite the bearish market
725,Trying to remember old Pre-2015 purchase (if that even matters)
726,4 years of Tong Jerky Accepting Bitcoin
727,Thy is the one that holds Bitcoin that is gifted
728,Is port forwarding to two nodes on the same router possible?
729,Can nyone help me with a blockchain.com fiasco I’m in?
730,"""Moving Billions of Dollars of Value over the Internet"" Starter Pack"
731,Bitcoin as a Retirement and Emergency Fund
732,US government just passed a $1.5 billion subsidy for Bitcoin mining
733,"When making a bitcoin transaction, are the fees related to the amount sent? Is there a base fee for a single transaction? Wondering if sending a larger amount is cheaper than multiple smaller amounts"
734,Obtaining BTC through P2P platforms
735,Does the price of BTC have to double with each halving?
736,Lightning Network Adoption
737,Bitcoin does not have to be a bad thing. Let us buy time
738,Would you willing leave your life savings with criminal enterprises previously found guilty of every financial crime possible? Bitcoin fixes this.
739,Michael Saylor - Bitcoin VS ...
740,I've been thinking of making a bitcoin YouTube show called 'Happy Money' and its basically 'Mad Money' but I only tell people to buy and hodl bitcoin. 😂
741,How safe is Binance to store your coins (read before answering)
742,Lightning Network 101 Explanation
743,100% Saylor - Michael Saylor Best Moments
744,VIDEO: Michael Saylor Says Goodbye as CEO | Hello as Bitcoin Chairman | Quits His Fiat Job to Go Full Time Bitcoin | Highlights of MicroStrategy Q2 Results | Aug 2nd 2022
745,Electro Magnetic Pulse; Bitcoin & cold wallets
746,FTX.US experience
747,Bitcoin will dump to $ 12K
748,I’ll just leave this here.
749,Help with privacy.
750,Bitcoin fixes this | INFLATION HELL: US Fed Created 50% More Money Out Of Thin Air In 2 Years Than Ever Existed In The Previous 256 Years
751,Bitcoin = Money + Time + Energy + Information
752,You Are Here.
753,Ledger Raises $100M at $1B Valuation to Fund Expansion Plans
754,Just moved everything to a cold wallet and I am super happy to be in control of my keys now. Is there anything else I should know?
755,"gradually, then suddenly"
756,"Hey, new Full Coiners: Congratulations!"
757,Alternatives to Coinmama.com?
758,"If Fidelity had a Bitcoin IRA, would you pour money into that VS. cold storage ownership. For the massive tax implications"
759,Price targets
760,Is it wise to have all your eggs in one basket?
