,0
0,Bitcoin in ancient Egyptian
1,El Salvador’s Bitcoin Bet Is Working
2,Im probably gonna try and borrow 50k from the bank soon
3,Today I paid my groceries thanks to Bitcoin Lightning Network even if in my country BTC is not a payment method yet.
4,Half price Haircuts for Bitcoin in Melbourne Australia
5,Cryptocurrency Iceberg Explained
6,The Bitcoin Blockchain: A Declaration of Monetary Independence
7,Whatbattracted you to ₿itcoin?
8,"Daily Discussion, August 06, 2022"
9,Strike Announces ‘Visa Card’ Feature Letting Users Pay Anywhere With Bitcoin
10,I have a legitimate question
11,Man entered the Federal Bank in Beirut with a shotgun and a canister of petrol and threatened to set himself on fire unless he was allowed to take out his money. A tragedy that can be avoided if he held his keys on Bitcoin standard.
12,Check out this amazing OP_RETURN
13,Very soon Bitcoin will bounce up.
14,"I know BTC is apolitical, but I don't see Dems posting things like this on social media...please correct me if I'm wrong..."
15,An oldie but a goodie from Forbes: How To Donate Bitcoin To Charity
16,“Hedge against inflation” from 1979. 32 years ago they were already advertising against inflation and you could get a savings account paying almost 10%
17,Missing Coins (DISCUSSION)
18,"If someone stole all my bitcoin through extortion (e.g. pointing a gun to my head), would there be ANY possibility for me to retrieve the BTC?"
19,Coinbase Custody and Blackrock Form New Partnership
20,Bitcoin is in the eye of the beHODLer
21,If (probably when) China goes after Taiwan
22,Positive things in a bear market
23,Where can I get gift cards online with Bitcoin?
24,Legacy - Segwit - Native Segwit - Taproot: Which 1 is Everybody Using?
25,The Current State of Bitcoin Mining with Harry Sudock — What Bitcoin Did
26,Same BTC IN/OUT from exchange? Making BTC anonymous with no KYC exchange.
27,"Daily Discussion, August 12, 2022"
28,My one and only Bitcoin
29,Michael Saylor - Bitcoin VS other coins
30,Michael Saylor Takes a Bitcoin Victory Lap on Fox & CNBC | His New Role as MicroStrategy Chairman | Aug 2-3 2022
31,How my friend got burned by a moron working for the tax authority
32,Deflation is bad only in a inflationary environment
33,I honestly think the reason Russia & China going against the US is because they know we’re gunna “ Rugpull “ all the debt the way we did when Nixon took money off the gold standard & in roaring 20’s 2.0 we switch to ( Bitcoin Standard )
34,"A Progressive Case for BTC: BTC ends the climate emergency. BTC accelerates green energy adoption. BTC ends egregious inequality caused by money printing. BTC creates efficiencies that benefit consumers. BTC reduces corruption. BTC spreads liberty, light and love. BTC gives The People economic power"
35,Should last mined coin continue to be mined infinitely divisible?
36,Bitcoin solves human distrust
37,Stop selling your Bitcoin!
38,Honest question to all of you
39,"Crypto Lender Hodlnaut Freezes Withdrawals, Citing Market Conditions"
40,Bitcoin proof of work difficulty adjustment is absolutely mind blowing
41,Will Bitcoin become a medium of exchange?
42,cutest Bitcoin NFC cards
43,"Tell me you don't use Bitcoin, without telling me you don't use Bitcoin. From this article: https://www.pymnts.com/cryptocurrency/2022/capital-gains-conundrum-is-senate-bills-50-exemption-for-crypto-purchases-too-low/ Second section, second paragraph."
44,"I wondering if Satoshi, new the 4th halving would happen on the 4th of May. May the fourth be with you."
45,will there ever be a bip to include real privacy / anonymity in bitcoin?
46,Found a cool wallet.
47,Nobody should be boasting how much BTC they have
48,If a government passed a law to ban bitcoin
49,It’s summer - it’s hot
50,"Michael Saylor steps down as MicroStrategy CEO, company takes $917 million charge on bitcoin"
51,How to give bitcoin as a gift to a non-coiner?
52,Diamond hands oven gloves featuring Diamond Emoji & Bitcoin Logo now available 💎 🙌
53,"Daily Discussion, August 05, 2022"
54,I found this.
55,What is the best way to gift bitcoin to somebody?
56,"It really is amazing how open source works. you wanna be a pain and enforce your will on the protocol? fine fork off. the free market decides what is valuable: not charisma, intellectual property, lawyers, power, threats."
57,"How Much It Costs To Mine A Single Bitcoin Around The World, Visualized"
58,Major cities in Japan revisit the idea of Bitcoin ATMs
59,"By golly, are we early?"
60,If the BTC we hold today ends up being worth 1M+ in the future would it not be wise to sell it at that point. Providing we can't buy every day things with it.
61,Bitcoin miners now hold a record 1.856M BTC — new data
62,Blokforge 10000 TH/s Miner.
63,Inflation Reduction Act should be called Bitcoin Adoption Act
64,Help me find on which website/wallet I had my BTC deposited in 2012
65,Inside Edition hilariously explains how Bitcoin works
66,Ledger nano s plus is here. I have very little amount in btc but this still is worth it
67,Third world bitcoin
68,Darin Feinstein: “the facts are on Bitcoin’s side.” The best under 20 minute orange-pill-talk on the internet. Great resource from a credible source.
69,This video is Internet Gold “Pepe buys Bitcoin “
70,I've gifted 0.01 bitcoin to my niece and nephew.
71,Are new private key and public key pairs generated for each transaction or is one private and public key pair associated with a wallet address which can be reused for multiple transactions?
72,Suggest a book for picking up Bitcoin on a technical level
73,Texas Bitcoin Miner Made Millions More in Power Credits Than Actually Selling Bitcoin
74,The ignorance of “programmers” on blockchain and bitcoin is shocking!
75,Xetra (Deutsche Boerse) started trading Bitcoin backed ETN
76,"This band made a Bitcoin treasure hunt, and the private keys to a bitcoin wallet are hidden in a series of puzzles, for people to solve + take the bitcoin for themselves"
77,"New York Times actually wrote an article stressing the difference between Bitcoin and ""crypto"""
78,"Built a *Lightning Only* Marketplace for my friends/fam. Rather than NFTs, our resident Photographer chose micro-txs instead :) Digital Art - lightningbazaar.com"
79,Finally put everything on cold storage
80,Strike deposit limits
81,Bitcoin > Stablecoins
82,Bitcoin
83,Thoughts/Question
84,How to get a wallet and buy bitcoin with no I’d?
85,Coinbase Attacks Bypass 2FA
86,Is it true that if a wallet address you send to is incorrect the coins are lost?
87,Bitcoin is freedom money in a world that’s losing its freedom.
88,bip39 - What's the benefit of the checksum word?
89,Is Privacy a fundamental human right?
90,"Daily Discussion, August 03, 2022"
91,"Showerthought: If, by some strange stretch of the imagination, all miners were forced to use renewables to mine bitcoin, it would still be too costly to attempt a 51% attack."
92,ITrustCapital is either fraudulent or incompetent — and all it’s customers are panicking because it feels like a massive rug-pull
93,Best non-KYC?
94,Stablesats :: Transact USD over Lightning without stablecoins or fiat integration
95,"PSA: send your test transactions to the EFF, FSF or others"
96,coinbase bug
97,I Created a Wallet with an Invaled Mnemonic... And it worked?? Very Strange... Help?
98,"Daily Discussion, August 04, 2022"
99,Short-Bitcoin ETF Sees First Week of Outflows Since Launch
100,Bitcoin futures ETF BITO doesn't appear to be suffering from contango
101,How can i buy BTC with low fees?
102,Improving your Antminer 19 series miner 70% hash rate by water-cooling kit
103,Why China’s Great Wall Central Planners Can’t Handle Bitcoin
104,Marc Andreeessen Discusses the Significance of Satoshi's Billions in Bitcoin Remaining Untouched (3-minute audio clip)
105,Educating the general public
106,Popping Off!
107,Victorian Police Now Have the Power to Seize Cryptocurrency Wallets
108,"Every time I buy something, I ask the owner if they accept Bitcoin"
109,Honest Question About The Future Of Bitcoin
110,This video delivered in Parliament 8 years ago symbolizes that Bitcoin is inevitable
111,Another reminder that you need to withdraw bitcoin from the exchange
112,Looks like it should be on the cover of a J.R.R. Tolkien novel
113,Approximately 1.34% of the world owns Bitcoin.
114,"How does/did Satoshi Nakamoto authenticate himself? If he were to make new public statements, how could the community verify that this was indeed the same person as the original Nakamoto?"
115,Is this vulnerability true?
116,BTC + KYC gets you pretty damn close to CBDC.
117,"Algorithmic buy/sell tool - BTC Price Potential in 5 years 361,000"
118,"Coinbase stock price has a high rise today because of some partnerships, but Wood has sold. Hope the Bitcoin price also 📈"
119,Finally I did it!
120,Opendime storage
121,Need advice!!!!
122,"Daily Discussion, August 02, 2022"
123,Going Up Forever Laura - Gigachad Remix
124,Bitcoin mining powered by animal waste
125,"Jeff Booth With Prophetic Wisdom | ""Energy Will Be Price in Bitcoin...Bitcoin Will Price Everything"" | Canadian Bitcoiners Podcast Clip"
126,GET READY For The Biggest Bitcoin Bull Market - Mike McGlone
127,"RE: Is it possible to increase bitcoin divisibility with a soft fork? If 90% of all miners / mining pools agree (as with taproot speedy trial), then is it possible to increase divisibility of Bitcoin?"
128,Escape with your bitcoin
129,"Mentor Monday, August 08, 2022: Ask all your bitcoin questions!"
130,What kind of background did Satoshi Nakamoto need to come up with Bitcoin?
131,The Cost of Mining One Bitcoin in 198 Different Countries
132,Is there a Bitcoin wallet that would you could set to autopay someone or multiple people an amount daily? Or add a pay list and ask you to confirm before it pays out everybody?
133,Why is nobody talking about china?
134,Apple pay for bitcoin: Offline first bitcoin wallet to store funds offline and make day to day purchase.
135,Just bought my first ever goods/services with BTC! £50 Amazon gift card from Bitrefill
136,Is the vast bitcoin private key address space security through obscurity?
137,Bitcoin Has an Ideological Problem (From Outside Ideology)
138,"If you’re invested in equities, know that Tim Cook also owns Bitcoin"
139,Bitcoin and Cryptocurrency Will Outperform Other Technologies
140,Economic Misconceptions of the Crypto World - Noahpinion (Noah Smith's Substack)
141,Bitcoin for Remittances Growing Rapidly
142,Bitcoin Newcomers FAQ - Please read!
143,My brain cannot even comprehend how these people function day to day...
144,Where to track BTC wallets owned by GBTC (grayscale bitcoin trust)?
145,"The US Treasury just sanctioned Tornado Cash, effectively locking the funds with respect to almost any law abiding American."
146,"Cryptocurrency ATMs installed globally have crossed 39,000 mark"
147,I believe most people investing in alt coins will sooner or later end up back at Bitcoin. I personally have been buying shit coins since 2018 and I have made some decent gains but eventually you see that it’s all a pump and dump scheme and you end up Back at Bitcoins door asking for forgiveness.!!
148,The Crypto Market Crashed. They’re Still Buying Bitcoin.
149,I have over 500k in bitcoin that I bought with borrowed money because I listened to Michael Saylor
150,Run a cln node with clightning4j tools on a tiny VPS
151,how to generate btc addres directly from btc network no intermidiaries??? anybody??
152,"In MicroStrategy Q2 earnings call, there's a little hint about Saylor's full time Bitcoin strategy as Executive Chairman"
153,"Newbie here, wanting to start buying into bitcoin. Is it most common to invest small amounts in Bitcoin over time? Is there a higher risk of losing one’s entire investment when only investing small amounts (with the goal of reaching one or more whole bitcoins)?"
154,Is this site legitimate?
155,Blackrock wallet speculation!
156,Slow but Steady Support Building?
157,"So Voyager just allowed withdrawals starting today. I currently hold only Bitcoin. Should I sell all of my Bitcoin, take my remaining cash, and take a loss of $4.5K or transfer my coins to a different wallet and hope Bitcoin will go up again? TIA!"
158,"Yesterday the European Central Bank (ECB) published a paper: “Towards the holy grail of cross-border payments“. -It explores six potential avenues to fix inefficient cross border payments, half of which use blockchain. The blockchain options include using the Bitcoin network and stablecoins."
159,Bitcoin Island: The Isle of Man is Turning Orange
160,You have brain?
161,:(
162,[Video] - There are millions of orphaned gas and oil wells leaking methane in the U.S. — and plugging them will cost billions.
163,This is WHY bitcoin is a bubble!
164,"Daily Discussion, August 07, 2022"
165,Still one of the best moments of BTC
166,I have been DCAing so hard i to Bitcoin during the downtrend that I'm in green again.
167,What is the greenest and most environmentally friendly way to get bitcoins?
168,Been Buying Bitcoin every month since October 2017 (59 months)
169,Mining BTC to avoid KYC
170,me holding on during this bear market
171,Reality: money supply inflation -> money loses corresponding purchasing power aka inflation -> wages must also inflate to keep the economy functioning -> wages never inflate as much as real goods -> standard of living is reduced for all but the wealthiest. Housing in Boise is up 59% since 2020.
172,Have you put in a 50 hours of bitcoin research?
173,Top cryptocurrency news: Coinbase is facing two fresh lawsuits amid SEC probe
174,When you have global currency but need local currency. Bitcoin ATM in Vietnam Pizzeria!
175,The better Incentive
176,Bitcoin adoption: Deloitte survey says Nearly 75% of retailers plan to accept either cryptocurrency or stablecoin payments within the next two years
177,Anyone know who this woman is at a Bitcoin conference?
178,"New Lyn Alden Epic Piece ""A Look at the Lightning Network"""
179,anytime is a good time
180,How I Escaped Financial Abuse with Bitcoin
181,"had 100k at ATH through loan leveraging, now I'm at 10k and building my confidence back up day by day."
182,“Bitcoin created a triple-entry ledger that self-audits and writes on-chain. It’s an immutable ledger entry that can never be altered. That’s the best accounting technology that’s ever been created by humans.” - @darinfeinstein
183,Is a deflationary currency compatible with growth-based economies?
184,The winter's here
185,Can BTC be hacked?
186,"Does the recent funding for the IRS have anything to do with further Bitcoin appreciation, or the predicted fallout from the naked short selling activity on Wall Street?"
187,"Few own a money printer and there's no cost to print money. The monetary system of an ""intelligent"" civilization"
188,"This is gold, i am sorry, this is bitcoin"
189,US Lawmakers Move to Clarify Definition of 'Brokers' in 2021 Infrastructure Law
190,Saving for a house down payment?
191,"Budgeting (re-made, couldn't find the original)"
192,A Progressive’s Case for Bitcoin with Jason Maier — What Bitcoin Did
193,Dump
194,My favorite Bitcoin meme so far!
195,SaylorRain Relaxing Michael Saylor speaks on Bitcoin with rain sounds (1H)
196,Bitcoin vs Fiat
197,I got a error syncing my wallet
198,How is this whale unknown?
199,NEW TO BICOIN
200,My personal experience with Bitcoin versus a copycat.
201,"Bitcoin Monitor Widget - cryptocurrency rates monitoring application, rate change notifications rules & alarms, local portfolio, customization, cross-platform. Recently released."
202,"MyNode Announces SDK, Marketplace Coming Soon!"
203,SCAM alert
204,Bitcoin Poker Game
205,<California ends ban on crypto campaign donations> Keep your cryptocurrency in a bear market or contribute?
206,Experience safe and secure crypto transactions with Cryptocurrency Wallet Development
207,Trust Blackrock?
208,Blockchain
209,Samsung's new mining chips will be 45% more efficient
210,Peter McCormack to Pay Only £1 in Damages in Lawsuit Against Faketoshi
211,My friend finally starts accepting bitcoin payments on his website...
212,BlackRock launches private trust offering direct bitcoin exposure
213,What would satoshi think of lightning network? Does this advance the vision of peer-to-peer cash or does this detract from the original vision?
214,"91% of Bitcoin has been mined, BTC is becoming rare there’s only 9% is left to be mined for over the next 118 years."
215,"It's mining right at 43k sats/day!!! Higher than it used to!!! (used to be only 39k sats, back in happier days when the price was in the $60Ks...) Should I keep it on or switch it off??? It's at about break-even... : - \"
216,Concern Regarding Distribution
217,Pierre Rochard | Bitcoin VS Gold | Soho Forum - Mises Institute Debate Highlights | Aug 8 2022
218,Own convenient stores and want to accept BTC.
219,Bitcoin is Better. Inflation is theft. Protect yourself & join. A peaceful revolution. Fix the money. Fix the world.
220,Export historical Muun transactions?
221,Bitcoin is turning into a “global collateral” as experts spot the increasing correlation with commodities
222,strike
223,"I had a dream, relocating to Mars"
224,"In my experience, smaller Dollar Cost Average(DCA) investors make the most money in the long run. Not because investing a large amount at once is a bad strategy, but because investing a large amount at once makes you emotionally attached to the dollar value of your Bitcoin holdings."
225,Dave Portnoy buys 29 Bitcoin and talks on future of crypto
226,BTC is going to breakout and crush ath very soon
227,"I did it. Just got to a very important stacking goal and transferred all to cold storage. Just so happened to be 21st strike transfer. I'd say that bodes well. I will start DCAing again soon, though in much smaller amounts, I've been focussing almost 100% to BTC lately so I can make this goal!"
228,"TIL in 1526, Copernicus wrote a study on the value of money, ""Monetae cudendae ratio"". In it he formulated an early iteration of the theory, now called Gresham's law, that ""bad"" (debased) coinage drives ""good"" (un-debased) coinage out of circulation."
229,how can I buy BTC with credit card?
230,To sell or not to sell
231,Saylor has stepped down as CEO to focus on Bitcoin. Jack also explained that “every single person in the world will benefit from Bitcoin.” Notice the trends.
232,Don't use Stake.com - Scammers
233,Problem using PGP to verify Electrum or Sparrow
234,In June 1.6 M people HODLed more than 100 USD worth of Bitcoin. Out of those 8% continued to save more than 100 USD worth of Bitcoin in July according to AugmentedCoin.io. Does this number seem low or high ???
235,"Any system that integrates with Bitcoin can benefit from its security, decentralization, solid monetary policy, and a mot more."
236,How would you estimate Bitcoin's future energy usage?
237,Ron Paul wisdom. 1988 - present day.
238,Netherlands Arrests Suspected Tornado Cash Developer
239,lost 2.4btc
240,Foundry Digital Donates 1 BTC To Developer Working On Bitcoin Mining Pools
241,Storing Seed Phrase - is this a safe way?
242,Kenyan Electoral Board Designs A Transparent Voting System That Mirrors The Bitcoin Blockchain
243,New Mini Terminal 'Kublet' Wants To Bring Moscow Time To Every Desk
244,Swan Bitcoin Discloses Data Leak Due to Phishing Attack on Newsletter Provider
245,Bitcoin Standard vs. Gold Standard: Bitcoin is cheaper to transfer. Bitcoin is impossible to confiscate on a mass scale. Bitcoin is cheaper to store. Bitcoin is a harder currency.
246,Oxford City football club to accept Bitcoin payments.
247,"200,000 sats on an OPENDIME up for grabs now in Central Park, left by BTC Sessions"
248,Bottom in
249,Bitcoin is heavily correlated to the stock market (maybe some day it won’t be). What the $MMTH tells us about whether the bottom is in.
250,Blockchain customer support
251,We are happy to inform you that Now we accepting Bitcoin on our Website 🔥
252,Nuri - ex Bitwala - filed for insolvency today (funds are safe)
253,Week in Bitcoin Texas Newsletter just dropped!
254,The European Central Bank regards Bitcoin as an expensive system. The report’s explanation
255,"so this ""coin corner bolt card"" which is advertised vigorously in the last days... is it possible to use this without any form of KYC or is there a hook attached which makes it worthless in the end?"
256,2048 ~
257,"From ""I've never met anyone that's owned bitcoin before"" to ""I'll go home and read about what Bitcoin is."""
258,Peter Schiff wants to talk about Bitcoin again. Here's a reminder from 2013 (when Bitcoin was $950) as to why you shouldn't care.
259,"Teaser for The Bigger Bubble, a sequel to the 9 * rated doc The Housing Bubble"
260,Why Bitcoin is Good for The Environment
261,"Beware of scammers guys. Peep the last screenshot. Only follow the instructions from your device, you don't gotta do anything more."
262,Bitcoin wallet found on my computer?
263,"Even the ECB Cannot Deny the Obvious: Bitcoin Is the Holy Grail of Cross-Border Payments. Obviously, you have to know how to read between the lines."
264,“Ownership”
265,[Question] Is it possible to transfert only 1 satoshi with the ligtning network without paying 1 satoshi fee ?
266,Why ECB thinks Bitcoin is Unlikely to be the Holy Grail of Cross Border Payments
267,Tapsigner Bitcoin Hardware Wallet: Security Meets Convenience?
268,Do you think it makes sense to have a term for 1/1000 of a bitcoin?
269,"Once you understand Bitcoin, you can't focus on anything else. Don't wait for someone else to work on Bitcoin"
270,"Galoy Launches Synthetic Dollars Backed by BTC, No Stablecoins Needed"
271,Getting all transactions from BTC block via RPC on local node with Python
272,To electrum offline wallet
273,Bitcoin fixes this
274,Record Number of Addresses Above 1 Bitcoin Amid Volatile Market
275,"It should Not be Bitcoin Vs Gold, it Should be Gold Vs Offline Recovery Seed!!"
276,19-year-old buys a house with Bitcoin
277,Free hardware wallets at Defcon
278,"LN Bitcoin now accepted in multiple locations across Boracay, Philippines!"
279,In the future bitcoin will allow instant stocks settlements. That is HUGE!
280,"JP Morgan Gold Scandal, CPI ""Falls"" to 8.5% with Phil Gibson @MrPseu - State of Bitcoin Ep. 35"
281,The Guardian: Craig Wright wins ‘only nominal damages’ of £1 in bitcoin libel case
282,"Hut 8 Maintains HODL Strategy, Adds 330 BTC"
283,Don't be me. Spent hours finding my future wealth in a pile of papers. Heart rate past safe limits when using 20 gazillion wallets. I hate being human.😁
284,Bitcoin is CDS on the Fed
285,"Introducing Cake Pay! Buy gift cards instantly with BTC, save 1-3%, for over 150,000 locations in the US, with email only! Only in Cake Wallet"
286,BTC doesn't have to be all or nothing to be successful!
287,Bitcoin being taught in high school and college ? Chapter in a math class? This would bring education and prosperity to the public. Opinions on this idea? Or an after school club would probably be more of what the school would allow but i’m hopeful
288,Here's Why You Can't Kill Bitcoin
289,How did you get your spouse on board with bitcoin?
290,What Impact Would a Collapse in USDT Price Have on BTC in the Short Term?
291,Excellent Crypto Fear and Greed Index
292,"This video doesn't mention Bitcoin, but its motivating me to go all in on Bitcoin"
293,"Bitcoin is an escape from the financial slavery propagated by fiat. Bitcoin is a lifeline to those who are drowning under the excesses and control of the fiat system. Fiat is taking us to a dark place, and Bitcoin is a light to lead us back from the brink of destruction."
294,Why can't bitcoin be based on something that has value?
295,so how do i justify to myself that i used 10 btc in 2015 on video game cosmetics. rather than saving to sell in 2019 - present day.
296,"Blackrock Alladin AI , US govt Large bitcoin holder, saudi oil & adoption"
297,Arrest of suspected developer of Tornado Cash \ stacker news
298,Bitcoin adoption matrix
299,How much should things costs in satoshi?
300,"Has anyone cashed out a large amount to their bank, such as 50k-100k, did the banks question anything?"
301,"Michael Saylor explains his ""magic car"" idea: embedding Bitcoin in an electric car would allow it to self-charge —— ""Buy the Bitcoin, attach the Bitcoin to a chip in the car, the car will run itself forever."""
302,"Daily Discussion, August 08, 2022"
303,IT'S GOING UP FOREVER LAURA - BTC inspired art based on DALLE A.I generated image
304,Something I made at work
305,Blog post about key recovery in Block’s wallet project
306,If you think Bitcoin is too complicated….😳
307,My Bitcoin Art
308,Disambiguation of semantics. Let's start talking more about currency expansion instead of inflation.
309,"Without the incentives around Bitcoin mining, energy infrastructure would be weaker, supply would be lower, and all electricity consumers would be worse off."
310,Thoughts on S4 seed protection
311,Need help with cold storage
312,DON'T LEAVE ANYTHING ON EXCHANGES ~ BTCMarkets (Aus) closing my account without reason after 5+ years of using their exchange 😵
313,I don't trust myself with cold storage - what is the safest - Coinbase or Binance?
314,Get your SATSCARD before first batch runs out! Ships in 1-2 weeks. 🎉🥳🖖
315,"Seedsigner - Raspberry Pi Based DIY Bitcoin Hardware Wallet... Great option for those who are very concerned with privacy, those looking to add to a multi-sig wallet or even folks who might already have most of the parts and haven't made the jump to hardware backed storage due to cost..."
316,"Istanbul, yesterday"
317,Ledger advice
318,"Even After Bitcoin Ban, China Still Accounts for 20% of Hash Rate"
319,Disused Wheel of Pain used to mine Bitcoin
320,Mastercard is bringing Bitcoin to Australia: a crypto-linked card is in the works.
